{
  "candidate_id": "synthetic-accepted-control",
  "gate": "Gate D",
  "status": "accepted",
  "downstream_allowed": true,
  "required_reviews": ["fresh_visual"],
  "reviews": [
    { "role": "fresh_visual", "file": "reviews/fresh-visual-review.json" }
  ],
  "forbidden_next_outputs": [],
  "notes": "Synthetic positive control for check-gate-status.mjs ONLY. All required reviews present and accept; downstream_allowed=true is consistent with status=accepted. This is not a visual precedent and backs no real artifact. See README.md."
}
